buyer,tender title,tender description ,tender category,postal_town,administrative_area_level_2,administrative_area_level_1,country
derbyshire county council,CST109 Aids to Rehabilitation (for Occupational Health),"Derbyshire County Council is out to tender for aids to rehabilitation following Occupational Health assessments. These aids are aimed at staff members requiring adjustments to their workstation(s) - ie. bespoke chairs, desks, additional support cushions, and other desktop items.

The Council requires a fully delivered service with installation and set-up options.",Miscellaneous medical devices and products,Matlock,Derbyshire,England,United Kingdom
derbyshire county council,PLACE306 Supply of Autodesk Licences,"Supply of Autodesk Licences
ITT documentation is accessible via www.eastmidstenders.org and placing a expression of interest.",Drawing and imaging software package,Matlock,Derbyshire,England,United Kingdom
derbyshire county council,"1076017b  Proposed Side and Rear Extension to a property located in Chesterfield, Derbyshire","Proposed Side and Rear Extension to a property located in Chesterfield, Derbyshire",Building construction work,Matlock,Derbyshire,England,United Kingdom
derbyshire county council,"PLACE430H Supply of UPVC Pipes, Ducting & Access Chambers","Derbyshire County Council is seeking a suppplier/s for the supply of UPVC pipes, ducting & access chambers.
The contract will be split into four lots:-
Lot 1 is for the supply of hdpe twin wall pipes and fittings
Lot 2 is for the supply of single wall underground drainage upvc underground
drainage pipes to bs en1401-1
Lot 3 is for the supply of upvc ducting
Lot 4 is for the supply of Access boxes covers and frames","Pipeline, piping, pipes, casing, tubing and related items",Matlock,Derbyshire,England,United Kingdom
derbyshire county council,PLACE306 Supply of Autodesk Licences,Supply of Autodesk Licences,Drawing and imaging software package,Matlock,Derbyshire,England,United Kingdom
derbyshire county council,CCP100 Secretariat Services for the f40 Group,"Derbyshire County Council, on behalf of the f40 Group, is out to tender for Secretariat Services for the group - working to raise issues around education funding and to campaign for change at a national level. The f40 Secretariat supports the f40 Group with strategy and campaign planning, media relations, social media and content creation as well as event management and general administrative tasks.",Business and management consultancy services,Matlock,Derbyshire,England,United Kingdom
derbyshire county council,SSD 23 21 Derbyshire Home Care Framework,"The Council is looking to establish a Derbyshire Home Care Framework of experienced CQC registered providers to deliver standard home care/domiciliary care services for Derbyshire County Council (excluding Derby City).

The Council is procuring the service detailed in the specification utilising a bespoke open procedure under the Light Touch Regime ('LTR') subject to limited regulation and will be conducted in accordance with regulations 74 to 76 PCR 2015.

The Framework will be established for 10 years in total, 6 years initial term with an option to extended up to a further 4 years. 

Following the initial opportunity to join, the Framework will remain closed and will only be opened to new providers as and when required by the Council.",Social work services,Matlock,Derbyshire,England,United Kingdom
herefordshire council,Fire Precautions improvements  At  Council Car Parks,"Deliver fire precaution improvements works at two Council owned pay and display car parks in the centre of Hereford.
The works include improvements to:
Fire alarm;
Fire Doors;
Emergency Lighting;
Means of Escape;
Fire Stopping; 
Signage;
",Sound or visual signalling apparatus,Hereford,Herefordshire,England,United Kingdom
herefordshire council,Fire Precautions improvements  At  Council Car Parks,"Herefordshire Council wishes to procure a contractor to deliver fire precaution improvements works at two Council owned pay and display car parks in the centre of Hereford. The Garrick Multi Storey car park is on 10 levels, the Maylord Orchards car park is on one level and is located at basement level beneath the Maylord Shopping Centre. The car parks are within a few hundred yards of each other geographically. The contract will be let on a JCT 2016 Minor Works Contract with Contractors Design.The works include improvements to:Fire alarm;Fire Doors;Emergency Lighting;Means of Escape;Fire Stopping; Signage;",Sound or visual signalling apparatus,Hereford,Herefordshire,England,United Kingdom
herefordshire council,Tender for the Promotion and Development of the Visitor Economy,"This tender relates to the development and promotion (both trade and consumer) of the Herefordshire visitor economy, such as local attractions, trails, tours and tourism products more generally.

Additional information: 
Herefordshire Council has published this contract opportunity on the 'Supplying the Southwest Portal'. To view the documentation related to this opportunity you will need to register on the portal if you are not already registered with Procontract, and express an interest in the opportunity.

To register with Procontract on the Supplying the Southwest Portal, click on the link below or copy and paste the link into your browser's address bar: https://www.supplyingthesouthwest.org.uk",Advertising and marketing services,Hereford,Herefordshire,England,United Kingdom
herefordshire council,Tender for the provision of  Weobley Primary School Boiler Replacement,"This tender relates to the replacement of a Biomass Boiler at Weobley Primary School. The works will include both strip out of the existing system and installation of a new system within the plant room.

Additional information: 
Herefordshire Council has published this contract opportunity on the 'Supplying the Southwest Portal'. To view the documentation related to this opportunity you will need to register on the portal if you are not already registered with Procontract, and express an interest in the opportunity.

To register with Procontract on the Supplying the Southwest Portal, click on the link below or copy and paste the link into your browser's address bar: https://www.supplyingthesouthwest.org.uk",Central-heating radiators and boilers and parts,Hereford,Herefordshire,England,United Kingdom
herefordshire council,"Ventilation Works at Aylestone High School, Hereford, Herefordshire.","Herefordshire Council has published this contract opportunity on the 'Supplying the Southwest Portal'. To view the documentation related to this opportunity you will need to register on the portal if you are not already registered with Procontract, and express an interest in the opportunity.

To register with Procontract on the Supplying the Southwest Portal, click on the link below or copy and paste the link into your browser's address bar: https://www.supplyingthesouthwest.org.uk 
",Plumbing and sanitary works,Hereford,Herefordshire,England,United Kingdom
herefordshire council,"Ventilation Works at Aylestone High School, Hereford, Herefordshire.",Herefordshire Council wishes to appoint a contractor to complete Ventilation Works at Aylestone High School. The full project scope is identified in the specification (Information document 1 Aylestone Ventilation Installation Specification).Herefordshire Council would like to thank you for your interest in this opportunity.,Plumbing and sanitary works,Hereford,Herefordshire,England,United Kingdom
herefordshire council,"Various Building Fabric Improvements At Merchant House, Hereford.","Herefordshire Council is seeking to appoint a Contractor to carry out building improvements including Asbestos Remediation, Redecorations, rainwater goods and new sanitary ware at Merchant House, Hereford.
Documentation relating to this opportunity is available on the E Portal, www.supplyingthesouthwest.org.uk.",Roof works and other special trade construction works,Hereford,Herefordshire,England,United Kingdom
herefordshire council,"Various Building Fabric Improvements At Merchant House, Hereford.","Various building fabric Improvements and redecorations at Merchant House, Hereford.Works include:Asbestos Remediation;Replacement rainwater goods;External redecorationsLocalised Internal redecorationsNew sanitary ware",Other building completion work,Hereford,Herefordshire,England,United Kingdom
herefordshire council,Invitation to Tender  for the provision of assessed individual support for disabled children,"The Council is seeking to contract with one or more providers in order to secure a minimum level of individual support hours to be delivered within the community or family home service.  The service will be for approximately twenty-nine children, who have been assessed by the council's Children with Disabilities team as requiring specialist daytime short breaks to be delivered in the community or in the family home.  This service is also referred to a buddying.  These twenty-nine children will require approximately 9,000 hours support in a twelve month period.  As some of the supported hours are already commissioned, the contract will initially be for at least 5,000 hours per year, with the potential to increase throughout the life of the contract.  
Additionally:
There is also a requirement for a pilot study Completion document 4: Invitation to Tender (ITT) Pilot study.  This is to provide assessed bespoke support and/or care that could be delivered either in the family home or other location to be confirmed based on individual case by case basis.  Parent carers may or may not be present when support hours are delivered

To view the documentation related to this opportunity you will need to register on the portal, if you are not already register with Procontract, and express an interest in the opportunity. To Register with Procontract on the Supplying the Southwest Portal click on the link below or copy and paste the link into your browser address bar; https://www.supplyingthesouthwest.org.uk 
",Social work services,Hereford,Herefordshire,England,United Kingdom
herefordshire council,"Invitation to Tender for the provision of  Refuge, dispersed refuge and support for victims of domestic abuse in HerefordshireFloating Support for Men and BoysSafe Accommodation and Floating Support Lived Experience Advisory Group Co-ordination","Herefordshire Council (the council) would like to thank you for your interest in this opportunity for the procurement of domestic abuse services in Herefordshire. This tender opportunity includes four specific lots as follows: 
•	Lot 1 - safe accommodation (refuge and extended refuge) and domestic abuse support services for adults and children.
•	Lot 2 - safe accommodation (dispersed units) and floating support for victims of domestic abuse in Herefordshire
•	Lot 3 - Domestic abuse support for men and boys 
•	Lot 4 - Lived Experience Advisory Group Co-ordination 

To view the documentation related to this opportunity you will need to register on the portal, if you are not already register with Procontract, and express an interest in the opportunity. To Register with Procontract on the Supplying the Southwest Portal click on the link below or copy and paste the link into your browser address bar; https://www.supplyingthesouthwest.org.uk
",Social work services,Hereford,Herefordshire,England,United Kingdom
herefordshire council,"Invitation to Tender for the provision of  Refuge, dispersed refuge and support for victims of domestic abuse in HerefordshireFloating Support for Men and BoysSafe Accommodation and Floating Support Lived Experience Advisory Group Co-ordination","This tender relates to support services for vulnerable adults and young people, it consists of two lots. A single contract will be awarded for each service lot.  However, tenders will be welcomed from provider partnerships, consortiums or those involving sub-contracting, as well as from individual providers. The provider will be expected to mobilise ready for the new service to commence delivery on the dates specified below. 
The council is interested in bids from organisations with substantial knowledge and experience of providing the relevant support service for homeless or potentially homeless vulnerable individuals who may be care experienced young people and people who may have multiple complex vulnerabilities.  Strong bids will also demonstrate proficiency and experience of working in an open, transparent and collaborative way across whole systems.
Whilst the accommodation based and floating support services are separate tender Lots they could be operated by a single provider or consortium and the tender is constructed to allow bids for either or all Lots.

To view the documentation related to this opportunity you will need to register on the portal, if you are not already register with Procontract, and express an interest in the opportunity. To Register with Procontract on the Supplying the Southwest Portal click on the link below or copy and paste the link into your browser address bar; https://www.supplyingthesouthwest.org.uk
",Social work services,Hereford,Herefordshire,England,United Kingdom
herefordshire council,"Invitation to Tender for the provision of  Refuge, dispersed refuge and support for victims of domestic abuse in HerefordshireFloating Support for Men and BoysSafe Accommodation and Floating Support Lived Experience Advisory Group Co-ordination","This tender relates to support services for vulnerable adults and young people, it consists of two lots. A single contract will be awarded for each service lot.  However, tenders will be welcomed from provider partnerships, consortiums or those involving sub-contracting, as well as from individual providers. The provider will be expected to mobilise ready for the new service to commence delivery on the dates specified below. The council is interested in bids from organisations with substantial knowledge and experience of providing the relevant support service for homeless or potentially homeless vulnerable individuals who may be care experienced young people and people who may have multiple complex vulnerabilities.  Strong bids will also demonstrate proficiency and experience of working in an open, transparent and collaborative way across whole systems.Whilst the accommodation based and floating support services are separate tender Lots they could be operated by a single provider or consortium and the tender is constructed to allow bids for either or all Lots.",Social work services,Hereford,Herefordshire,England,United Kingdom
lincolnshire county council,"Integrated Sexual Health and Sexual Health Outreach, HIV Prevention and Support Services.","Tenders are invited for the supply of Integrated Sexual Health and Sexual Health Outreach, HIV Prevention and Support Services across Greater Lincolnshire, which incorporates the administrative counties of Lincolnshire, North Lincolnshire and North East Lincolnshire. This procurement is being undertaken by Lincolnshire County Council for and on behalf of Lincolnshire County Council, North and North East Lincolnshire Councils.

The tender is split into three lots:
Lot 1 - Integrated Sexual Health Services for Lincolnshire (Lincolnshire County Council)
Lot 2 - Integrated Sexual Health Services for Northern Lincolnshire (North and North East Lincolnshire Councils)
Lot 3 - Sexual Health Outreach, HIV Prevention and Support Services across Greater Lincolnshire (Lincolnshire County Council, North and North East Lincolnshire Councils)

A 'Greater Lincolnshire' approach is being utilised for this tender, as a joint vision between Lincolnshire County Council, North East Lincolnshire Council and North Lincolnshire Council to ensure consistency in the provision of sexual health services for the population of the Greater Lincolnshire area. This approach aims to deliver more joined up services with a single service specification and hence more consistency in service models and digital interfaces.",Social services,Lincoln,Lincolnshire,England,United Kingdom
lincolnshire county council,Community Supported Living - Adults - Open Select List - Reopening 2023,"Lincolnshire County Council will be undertaking a procurement under the Light Touch Regime, pursuant to Regulation 76(7) of the Public Contracts Regulations 2015 (PCR), for a community supported living service in Lincolnshire.

The Council is seeking to re-open the existing Community Supported Living - Open Select List Framework to new approved providers who can deliver the following services referred to as community supported living services.

Lot 1

A) Care and Support Only
B) Care and support in existing and established dedicated accommodation settings
C) Care and support with a new accommodation requirement

Lot 2
D) Care and support in exceptional circumstances.

Current contractual arrangements are in operation for the commissioning of Community Supported Living services as detailed for vulnerable adults who may have a range of different needs including learning disabilities, physical disabilities, mental health and co-occurring conditions, and this is an opportunity for non commissioned providers to join the framework.

The purpose of the service is to enable vulnerable adults to develop existing skills or acquire new skills to increase their independence in daily living through appropriate risk taking, identify and enable opportunities for education and employment, and ultimately meet their desired outcomes as detailed within their Personal Plan. In addition services focus on keeping individuals healthy and safe.",Social work services,Lincoln,Lincolnshire,England,United Kingdom
manchester city council,TC1180 - Wythenshawe Civic Development Partner and Joint Venture Asset Manager Partner,"The Council wish to drive regeneration across Wythenshawe Civic by creating a vibrant and high-quality neighbourhood. The Council are seeking to appoint a partner to realise this vision by aiding in the design, delivery and funding of at least 1,600 residential dwellings across Wythenshawe Civic as well as revitalising the Civic Shopping Centre. This is a significant opportunity to invest in a large, well-connected area of South Manchester.",Building construction work,Manchester,Greater Manchester,England,United Kingdom
manchester city council,TC1180 - Wythenshawe Civic Development Partner and Joint Venture Asset Manager Partner,"The Council wish to drive regeneration across Wythenshawe Civic by creating a vibrant and high-quality neighbourhood. The Council are seeking to appoint a partner to realise this vision by aiding in the design, delivery and funding of at least 1,600 residential dwellings across Wythenshawe Civic as well as revitalising the Civic Shopping Centre. This is a significant opportunity to invest in a large, well-connected area of South Manchester.",Building construction work,,Greater Manchester,England,United Kingdom
manchester city council,TC1180 - Wythenshawe Civic Development Partner and Joint Venture Asset Manager Partner,"The Council wish to drive regeneration across Wythenshawe Civic by creating a vibrant and high-quality neighbourhood. The Council are seeking to appoint a partner to realise this vision by aiding in the design, delivery and funding of at least 1,600 residential dwellings across Wythenshawe Civic as well as revitalising the Civic Shopping Centre. This is a significant opportunity to invest in a large, well-connected area of South Manchester.

Additional information: 
The Council is using the e-business portal known as the Chest. Applicants will need to register their details at the following link www.the-chest.org.uk. Applicants will need to electronically submit their completed Request to Participate documents, including standard selection questionnaire, via the on-line portal by 5pm on 8th November 2023.",Building construction work,Manchester,Greater Manchester,England,United Kingdom
manchester city council,TC1180 - Wythenshawe Civic Development Partner and Joint Venture Asset Manager Partner,"The Council wish to drive regeneration across Wythenshawe Civic by creating a vibrant and high-quality neighbourhood. The Council are seeking to appoint a partner to realise this vision by aiding in the design, delivery and funding of at least 1,600 residential dwellings across Wythenshawe Civic as well as revitalising the Civic Shopping Centre. This is a significant opportunity to invest in a large, well-connected area of South Manchester.

Additional information: 
The Council is using the e-business portal known as the Chest. Applicants will need to register their details at the following link www.the-chest.org.uk. Applicants will need to electronically submit their completed Request to Participate documents, including standard selection questionnaire, via the on-line portal by 5pm on 8th November 2023.",Building construction work,,Greater Manchester,England,United Kingdom
manchester city council,TC623   NORTH WEST CONSTRUSTION HUB - LOW VALUE CONSTRUCTION FRAMEWORK (2024 TO 2028),The nature and types of work that may be required are Building construction work. Construction work for social facilities other than subsidised residential accommodation. Daycare Centre construction work.  Civic Centre construction work. Construction work for crematoriums. Cemetery works. Construction work for buildings relating to law and order or emergency services. Construction work for buildings of further education.  Construction work for research buildings. Laboratory building construction work. Research and testing facilities construction work. Scientific installations. Meteorological stations construction work. Construction work for halls of residence. Training facilities building. Construction work for buildings relating to health. Construction work for social services buildings. Construction work for subsidised residential accommodation. Retirement home construction work. Nursing home construction work. Residential homes construction work. Children's home construction work. Construction work for buildings relating to air transport. Airport buildings construction work. Airport control tower construction work. Construction work for buildings relating to water transport.  Construction work for buildings relating to education and research. Construction work for kindergarten buildings. Schools.  Construction work for school buildings. Primary school construction work. Secondary school construction work.  Special school construction work. Construction work for college buildings. Vocational college construction work.  Technical college construction work. Construction work for university buildings. Polytechnic construction work.  Lecture theatre construction work. Language laboratory construction work. Construction work for commercial buildings. Shop buildings construction work. Shopping Centre construction work. Shop units construction work. Market construction work. Covered market construction work. Open-air market construction work.  Office block construction work. Construction work for warehouses and indus,Building construction work,Manchester,Greater Manchester,England,United Kingdom
manchester city council,TC623   NORTH WEST CONSTRUSTION HUB - LOW VALUE CONSTRUCTION FRAMEWORK (2024 TO 2028),The nature and types of work that may be required are Building construction work. Construction work for social facilities other than subsidised residential accommodation. Daycare Centre construction work.  Civic Centre construction work. Construction work for crematoriums. Cemetery works. Construction work for buildings relating to law and order or emergency services. Construction work for buildings of further education.  Construction work for research buildings. Laboratory building construction work. Research and testing facilities construction work. Scientific installations. Meteorological stations construction work. Construction work for halls of residence. Training facilities building. Construction work for buildings relating to health. Construction work for social services buildings. Construction work for subsidised residential accommodation. Retirement home construction work. Nursing home construction work. Residential homes construction work. Children's home construction work. Construction work for buildings relating to air transport. Airport buildings construction work. Airport control tower construction work. Construction work for buildings relating to water transport.  Construction work for buildings relating to education and research. Construction work for kindergarten buildings. Schools.  Construction work for school buildings. Primary school construction work. Secondary school construction work.  Special school construction work. Construction work for college buildings. Vocational college construction work.  Technical college construction work. Construction work for university buildings. Polytechnic construction work.  Lecture theatre construction work. Language laboratory construction work. Construction work for commercial buildings. Shop buildings construction work. Shopping Centre construction work. Shop units construction work. Market construction work. Covered market construction work. Open-air market construction work.  Office block construction work. Construction work for warehouses and indus,Building construction work,,Greater Manchester,England,United Kingdom
manchester city council,TC623   NORTH WEST CONSTRUSTION HUB – LOW VALUE CONSTRUCTION FRAMEWORK (2024 TO 2028),"The projects let under the Framework Agreement may be of a new-build nature, including demolition, development, refurbishment, or re-modelling of existing properties owned and /or used by the framework users.",Building construction work,Manchester,Greater Manchester,England,United Kingdom
