buyer,tender title,tender description ,tender category,postal_town,administrative_area_level_2,administrative_area_level_1,country
manchester city council,TC623   NORTH WEST CONSTRUSTION HUB – LOW VALUE CONSTRUCTION FRAMEWORK (2024 TO 2028),"The projects let under the Framework Agreement may be of a new-build nature, including demolition, development, refurbishment, or re-modelling of existing properties owned and /or used by the framework users.",Building construction work,,Greater Manchester,England,United Kingdom
manchester city council,TC1179 - Contraception and Sexual Health Service for Young People,"Contraception and Sexual Health Service for Young People.

Additional information: 
The Council is using the e-business portal known as the Chest. Applicants will need to register their details at the following link www.the-chest.org.uk. Applicants will need to electronically submit their completed tender documents via the online portal by 11 a.m. on 30th October 2023.",Medical practice and related services,Manchester,Greater Manchester,England,United Kingdom
manchester city council,TC1179 - Contraception and Sexual Health Service for Young People,"Contraception and Sexual Health Service for Young People.

Additional information: 
The Council is using the e-business portal known as the Chest. Applicants will need to register their details at the following link www.the-chest.org.uk. Applicants will need to electronically submit their completed tender documents via the online portal by 11 a.m. on 30th October 2023.",Medical practice and related services,,Greater Manchester,England,United Kingdom
manchester city council,"TC1017 - The Provision of an Infrastructure service for the Voluntary, Community and Social Enterprise (VCSE) Sector","The Provision of an Infrastructure service for the Voluntary, Community and Social Enterprise (VCSE) Sector.
We are seeking to commission an organisation (or organisations working in partnership with a lead ) to provide citywide 'infrastructure support' to the VCSE sector in Manchester. This specification will explain what we mean by infrastructure support, and what will be required of you as an applicant. The successful applicant will act as a leading strategic partner in the city, working with other leaders across sectors in alignment with the city's priorities and strategies, including the Our Manchester Strategy and the Making Manchester Fairer action plan.

Additional information: 
The Council is using the e-business portal known as the Chest. Applicants will need to register their details at the following link www.the-chest.org.uk. Applicants will need to electronically submit their completed tender documents, including online questionnaire, via the on-line portal by 11am on Monday 6 November 2023",Business and management consultancy services,Manchester,Greater Manchester,England,United Kingdom
manchester city council,"TC1017 - The Provision of an Infrastructure service for the Voluntary, Community and Social Enterprise (VCSE) Sector","The Provision of an Infrastructure service for the Voluntary, Community and Social Enterprise (VCSE) Sector.
We are seeking to commission an organisation (or organisations working in partnership with a lead ) to provide citywide 'infrastructure support' to the VCSE sector in Manchester. This specification will explain what we mean by infrastructure support, and what will be required of you as an applicant. The successful applicant will act as a leading strategic partner in the city, working with other leaders across sectors in alignment with the city's priorities and strategies, including the Our Manchester Strategy and the Making Manchester Fairer action plan.

Additional information: 
The Council is using the e-business portal known as the Chest. Applicants will need to register their details at the following link www.the-chest.org.uk. Applicants will need to electronically submit their completed tender documents, including online questionnaire, via the on-line portal by 11am on Monday 6 November 2023",Business and management consultancy services,,Greater Manchester,England,United Kingdom
manchester city council,"TC1017 - The Provision of an Infrastructure service for the Voluntary, Community and Social Enterprise (VCSE) Sector","We are seeking to commission an organisation (or organisations working in partnership with a lead ) to provide citywide ‘infrastructure support’ to the VCSE sector in Manchester. This specification will explain what we mean by infrastructure support, and what will be required of you as an applicant. The successful applicant will act as a leading strategic partner in the city, working with other leaders across sectors in alignment with the city’s priorities and strategies, including the Our Manchester Strategy and the Making Manchester Fairer action plan.",Miscellaneous membership organisations services,Manchester,Greater Manchester,England,United Kingdom
manchester city council,"TC1017 - The Provision of an Infrastructure service for the Voluntary, Community and Social Enterprise (VCSE) Sector","We are seeking to commission an organisation (or organisations working in partnership with a lead ) to provide citywide ‘infrastructure support’ to the VCSE sector in Manchester. This specification will explain what we mean by infrastructure support, and what will be required of you as an applicant. The successful applicant will act as a leading strategic partner in the city, working with other leaders across sectors in alignment with the city’s priorities and strategies, including the Our Manchester Strategy and the Making Manchester Fairer action plan.",Miscellaneous membership organisations services,,Greater Manchester,England,United Kingdom
sandwell metropolitan borough council,Toxicology Services 2024 - 2028,"Sandwell MBC (the ""Council"") is the relevant authority for the Black Country Coroners Jurisdiction which covers four local authority areas namely; Sandwell MBC, Dudley MBC, Walsall MBC and the City of Wolverhampton. Annually approximately 5000 deaths are reported to the Senior Coroner for the Black Country.  When discharging his or her judicial responsibilities, a coroner will make whatever inquiries are necessary when endeavouring to establish a cause of death. Those inquiries although not exclusively may involve a Digital Autopsy scan, a Post Mortem examination and in some instances the use of Toxicology Services to ensure that service he or she provides meets the needs of the bereaved in a timely manner.   The Council is therefore co-ordinating a tender exercise for Toxicology Services and wishes to invite interested suppliers (""Tenderers"") to participate in a tender exercise in relation to the supply of these services (""invitation to Tender"" or ""ITT"").",Pollutants tracking and monitoring and rehabilitation services,West Bromwich,West Midlands,England,United Kingdom
sandwell metropolitan borough council,Parking and Traffic Enforcement Services,"Sandwell MBC (the ""Council"") wishes to appoint a Contractor to provide and manage a range of parking related services. These will relate primarily to enforcement activities, both on-site and administrative. Other related services will be also be required, where they have a close connection with the enforcement aspects.  The Council's intention is for the contract to be let for a period of five years, with a possible extension of a further two years, at the Council's sole discretion. The successful Tenderer will be obliged to enter into a sealed contract with the Council which will be based on the contract specification, the suppliers schedule of rates, the suppliers tender response and post tender clarifications and the appended BPA standard contract for the provision of decriminalised traffic and parking enforcement services as amended and updated by the Council.

Additional information: 
Is a Recurrent Procurement Type? : No",Civic-amenity services,West Bromwich,West Midlands,England,United Kingdom
sandwell metropolitan borough council,Parking and Traffic Enforcement Services,"Sandwell MBC (the ""Council"") wishes to appoint a Contractor to provide and manage a range of parking related services. These will relate primarily to enforcement activities, both on-site and administrative. Other related services will be also be required, where they have a close connection with the enforcement aspects.  The Council’s intention is for the contract to be let for a period of five years, with a possible extension of a further two years, at the Council’s sole discretion. The successful Tenderer will be obliged to enter into a sealed contract with the Council which will be based on the contract specification, the suppliers schedule of rates, the suppliers tender response and post tender clarifications and the appended BPA standard contract for the provision of decriminalised traffic and parking enforcement services as amended and updated by the Council.",Civic-amenity services,West Bromwich,West Midlands,England,United Kingdom
sandwell metropolitan borough council,Advocacy Services,"Provision of Advocacy Services
      
      Sandwell Metropolitan Borough Council invites tenders for the delivery of Advocacy Services. 
      
      The purpose of the Advocacy Services is to provide high-quality support to Service Users who are legally eligible to receive advocacy under existing legislation, and to provide non-statutory advocacy to inpatients who are voluntarily in hospital due to their mental health diagnosis and treatment. These Services will ensure that as many people as possible in Sandwell who are legally eligible to access these services do access them, have their legal rights upheld, and are effectively supported to engage with the processes and decisions in relation to their health and social care needs. The services will ensure that the Service User's voice (or best interests in the case of IMCA/IMCA DOLS) are at the heart of any decisions made and ensure maximum choice, safety and independence for service users.
      The services in this contract are:
      1. Care Act Advocacy
      2. Independent Mental Capacity Advocacy / Deprivation of Liberty (IMCA/ IMCA DoLS) and Relevant Paid Person Representatives (RPPR)
      3. Independent Mental Health Advocacy (IMHA) and Inpatient Mental Health Advocacy
      4. Independent Complaints Advocacy (ICAS)
      The successful contractor will be required to deliver Advocacy Services in compliance with legislation including the Care Act 2014, Mental Capacity Amendment Act 2005 and the Amendment Act 2019, Mental Health Act 1983 and NHS and Social Care Act 2012, and to ensure all services  are flexible and responsive to developments in legislation, policy and guidance, and to any variations in demand for any of the services. 
      The successful contractor will also be required to work to outcomes, including:
      o Improved awareness and take up of Statutory Advocacy
      o Improved services and service practices 
      
      The duration of the contract will be four (4) years from 1 April 2024 to 31 March 2028. Tenderers should note that t",Social work services,West Bromwich,West Midlands,England,United Kingdom
sandwell metropolitan borough council,Advocacy Services,"Sandwell Metropolitan Borough Council invites tenders for the delivery of Advocacy Services. The purpose of the Advocacy Services is to provide high-quality support to Service Users who are legally eligible to receive advocacy under existing legislation, and to provide non-statutory advocacy to inpatients who are voluntarily in hospital due to their mental health diagnosis and treatment. These Services will ensure that as many people as possible in Sandwell who are legally eligible to access these services do access them, have their legal rights upheld, and are effectively supported to engage with the processes and decisions in relation to their health and social care needs. The services will ensure that the Service User's voice (or best interests in the case of IMCA/IMCA DOLS) are at the heart of any decisions made and ensure maximum choice, safety and independence for service users.
The services in this contract are:
1.	Care Act Advocacy
2.	Independent Mental Capacity Advocacy / Deprivation of Liberty (IMCA/ IMCA DoLS) and Relevant Paid Person Representatives (RPPR)
3.	Independent Mental Health Advocacy (IMHA) and Inpatient Mental Health Advocacy
4.	Independent Complaints Advocacy (ICAS)
The successful contractor will be required to deliver Advocacy Services in compliance with legislation including the Care Act 2014, Mental Capacity Amendment Act 2005 and the Amendment Act 2019, Mental Health Act 1983 and NHS and Social Care Act 2012, and to ensure all services  are flexible and responsive to developments in legislation, policy and guidance, and to any variations in demand for any of the services. 
The successful contractor will also be required to work to outcomes, including:
•	Improved awareness and take up of Statutory Advocacy
•	Improved services and service practices 
Tenderers should note that the Council has a maximum budget for all services which is £246,242 per contract year, and a maximum total contract value over the duration of the contract being £984,968. Further details can be found in the Invita",Social work services,West Bromwich,West Midlands,England,United Kingdom
sandwell metropolitan borough council,Sandwell Valley Country Park Festival,"Sandwell Metropolitan Borough Council is seeking a Festival organiser / promote to procure the rights to deliver a festival over 4 days (or two sets of two days) at Sandwell Valley Showground, using Dartmouth Park as a walk through to the festival (and further opportunity for three years.

Additional information: 
The Council will be using the In-tend e-Tendering System for this Procurement exercise, please visit https://in-tendhost.co.uk/sandwellmbc to access the Sandwell MBC In-tend Supplier Portal.

From here you will be able to register your company, express an interest in the opportunity, and gain immediate access to Quotation or other related documents.

To submit a quotation you will be required to 'Opt In'.

For a Step by Step user guide to the Sandwell MBC In-tend Supplier Portal please click on the `Guidance for Suppliers` section of the website. All procurement responses must be carried out via the Sandwell MBC In-tend Supplier Portal.  

If you require further assistance in respect of the system please contact the In-tend support team on 0844 272 8810. 



Is a Recurrent Procurement Type? : No","Exhibition, fair and congress organisation services",West Bromwich,West Midlands,England,United Kingdom
sandwell metropolitan borough council,Service Specification for the Provision of Support for Community Led Early Years Groups in Sandwell,"Service Specification for the Provision of Support for Community Led Early Years Groups in Sandwell
      
      Sandwell Council would like , the provider will be expected to be:
      1. An important additional family hub service, that actively contributes to the Home Learning Environment workstream and improve access to the wider offer of family hub services to our families with under-fives.
      2. To provide a focused support in one or more towns to help support school readiness.
      3. Able to build strong and effective relationships with community volunteer led stay and plays across Sandwell.  We expect you to build the network, increasing the number of groups that join it, month on month.  
      4. Able to share key messages across community led stay and plays promoting Sandwell Family hubs, ensuring that our community Stay and Play groups are involved and part of the Sandwell Family Hub network.
      5. Able to share key messages across community led stay and plays promoting key messages from departments within Sandwell Metropolitan Council including Public Health.
      6.  Able to share key messages across community led stay and plays promoting Early Help, ensuring that our community Stay and Plays are involved and part of the Early help network.
      7. To provide regular updates to the family hub project implementation group, which meets monthly.
      8. To attend Sandwell Family hub meetings to ensure the voices of parents and community stay and plays are heard.
      9. To support the completion of family hub research and parent surveys via the stay and plays.
      10. To complete quarterly returns demonstrating progress and impact of the service.
      11. Service delivery will be in line with the local delivery plan, as approved by the government, and the national programme expectations for Family hubs. 
      12. The provider to work closely with SVCO, ensuring information about grants, development support and volunteer support, which will be key to ensure the sustainability of this wor",Social work services,West Bromwich,West Midlands,England,United Kingdom
sandwell metropolitan borough council,Reopening Sandwell Domiciliary Care Service,"Reopening of ASC084 Domiciliary Care Service - Sandwell Metropolitan Borough Council wishes to Reopen the ITT for the addition of Providers to the Tier 2 List for the provision of Domiciliary Care to eligible individuals living in Sandwell. All Providers appointed will be required to deliver the Service across the whole of the Borough of Sandwell. It is anticipated that the Service, across both Tier 1 and Tier 2, will support approximately 20,000 to 25 000 hours of care per week, however the amount of hours of care per week may vary during the duration of the Agreement. The Service will provide a broad range of general personal care and support services to eligible adults (18 years old and over) aimed at enabling individuals to maintain and recover maximum independence, support their wellbeing, provide support to individuals who have recently left hospital and ultimately allow people to remain living in their own homes. The hourly rate for the period 1 April 2023 to 31 March 2024 is ?18.40 for the service has been set by the Council which will be reviewed annually in April of each year. Where appropriate, rates will be increased using a Fee Rate Escalator or through Market Sustainability uplifts. Where a Market Sustainability uplift has been utilised then the Fee Rate Escalator will not apply for that year. Details of the Fee Rate Escalator are contained in the Procurement Documents. Providers will be required to provide a high-quality service that aligns with the Council's vision for Adult Social Care and whilst participating in the further implementation of the personalisation agenda, giving citizens greater choice and control in this process. The overarching Domiciliary Care Service Agreement commenced on 1st September 2022 for an initial period of 5 years with the option of extending for up to an additional 5 years. The Effective Date for the Reopening of the service is 2nd April 2024. Bidders attention is drawn to and they should note the following:  a) There is no guarantee of volumes of work as referrals ",Social work services,West Bromwich,West Midlands,England,United Kingdom
sandwell metropolitan borough council,Tender for the Supply of Timber Materials - 2024 - 2027,"Tender for the Supply of Timber Materials 2024 - 2027 - Sandwell Metropolitan Borough Council has a requirement for a range of timber and timber products as detailed in the pricing schedule for delivery into the Council's supplies section at Roway Lane, Oldbury, West Midlands carriage paid. The Council will be using the In-tend e-Tendering System for this Procurement exercise, please visit https://in-tendhost.co.uk/sandwellmbc to access the Sandwell MBC In-tend Supplier Portal.Value range between £1200000 and £1500000Additional TextIs a Recurrent Procurement Type? : NoAdditional information on how to apply for this contracthttps://in-tendhost.co.uk/sandwellmbc/aspx/",Wood,West Bromwich,West Midlands,England,United Kingdom
sandwell metropolitan borough council,Tender for the Supply of Timber Materials - 2024 - 2027,"Tender for the Supply of Timber Materials 2024 - 2027 - Sandwell Metropolitan Borough Council has a requirement for a range of timber and timber products as detailed in the pricing schedule for delivery into the Council's supplies section at Roway Lane, Oldbury, West Midlands carriage paid. The Council will be using the In-tend e-Tendering System for this Procurement exercise, please visit https://in-tendhost.co.uk/sandwellmbc to access the Sandwell MBC In-tend Supplier Portal.

Additional information: 
Is a Recurrent Procurement Type? : No",Wood,West Bromwich,West Midlands,England,United Kingdom
sandwell metropolitan borough council,Trusted Assessor Service,"Trusted Assessor Service. Sandwell Metropolitan Borough Council wishes to appoint a single Provider to the ASC113 Trusted Assessor Service to provide assessments for eligible individuals ready for discharge from hospital in Sandwell.People can sometimes wait too long for discharge from hospital resulting in poor experience of the health and care system and poorer outcomes.Trusted Assessor schemes are a national initiative designed to reduce delays when people are ready for discharge from hospital. Providers accept assessments carried out by suitably qualified 'Trusted Assessors' working under formal, written agreements.Research has shown that delayed discharges can have a significant negative impact on people's well-being. There are also risks associated with premature or poorly planned discharges.The use of a Trusted Assessor Service can reduce the numbers and waiting times of people awaiting discharge from hospital and help them to move from hospital back home or to another setting speedily, effectively and safely thereby improving patient experience, clinical safety and patient flow.The Service will operate 7 days a week. The Specification, attached as Appendix 2 to the Invitation to Tender, details the aims of the service to be provided within the contract and the connections to other services in the community.The Provider will be required to provide a high-quality service that aligns with the Council's vision for Adult Social Care.The Trusted Assessor Service Agreement will commence on 1st April 2024 for an initial period of 2 years with the option of extending for up to a further 12 months.Suitably qualified and experienced persons and organisations can view the full tender documentation that includes the Invitation to Tender, which contains details of the evaluation criteria and methodology, and Tender Response Documents; detailed Specification(s) and a copy of the Council's standard Terms and Conditions of Agreement by registering on Sandwell's In-Tend Supplier Portal.The Council will be using the In-Ten",Miscellaneous health services,West Bromwich,West Midlands,England,United Kingdom
tyne and wear fire and rescue service (twfrs),Lorry Loader and Hoist Operator Course and Slinger and Signallers Course,The primary objective of the Contract is to provide the provision of Lorry Loader and Hoist Operator Course and Slinger and Signallers Course.,Vocational training services,Sunderland,Tyne and Wear,England,United Kingdom
west sussex county council,CBC Library Book and AV Framework,Provision of Library Books and Audio visual material to the CBC Library Group,Printed books,Chichester,West Sussex,England,United Kingdom
west sussex county council,WSCC Domestic Abuse Safe Accommodation and Support Service,"West Sussex County Council is procuring a Domestic Abuse Support service covering the county of West Sussex that will accommodate and support customers in dispersed Accommodation units rather than in traditional refuge style. The services will accommodate and support those that historically have not been able to access refuge services.
These include, however are not limited to:
• those with older male children
• women with additional support needs such as mental health issues
• larger families
• men experiencing domestic abuse

The Pan Sussex Domestic Abuse strategy states that:

• Sussex local authorities should provide more domestic abuse accommodation spaces for women and their children, according to the Council of Europe's minimum standards.
• A broader menu of domestic abuse safe accommodation options, in line with a Whole Housing Approach, should be developed in Sussex. Consideration should be given to ensuring all new accommodation options are appropriate and quality assured.

This service will help meet these aims and targets by providing more safe accommodation spaces that can be accessed by a wider range of customers.

This tender is split into 2 Lots:

Lot 1 North

This Service will provide self-contained accommodation and support for at least 8 households experiencing domestic abuse. The accommodation units provided must be in the Crawley, Horsham or Mid Sussex Districts of West Sussex.

Lot 2 South

This Service will provide self-contained accommodation and support for at least 8 households experiencing domestic abuse. The accommodation units provided must be in the Adur, Arun, Chichester or Worthing districts of West Sussex.

To register as a supplier for West Sussex County Council's E-Tendering portal please visit the following link:
https://atamis-7669.my.site.com/ProSpend__CustomCommunitiesLogin?startURL=/home/home.jsp",Social work services,Chichester,West Sussex,England,United Kingdom
